{"aggregateHash":"c2746a3a166f4a31517250c61558fd83ff829190ad9d039a5a3af6528b6cf6fb","entries":[{"opaqueSourceUnitId":"43fa36e9cbb26592aca68cfce1ad5def402ef36ac53c0146f622a1b1d218c70d","payload":{"displayName":"hash-dag.txt"},"payloadHash":"2ed3cf073f80ba073456e231e8617d948ea21a46348f1418548e53d1307c3e69","payloadKind":"raw_file_display_name","payloadKindRank":0,"payloadOrdinal":0,"sourceUnitKind":"raw_file","sourceUnitOrdinal":0,"sourceUnitPayloadRef":"8e91a015d7693a00fa3d75e7776836b02967d4113cc125542de1cc9540512d39"}],"entryCount":1,"schemaVersion":"source-unit-resolver.v1","sourceSha256":"3a413cf18e813c868e5859350b4a6e02fe271e2bf4224b92eb14cf3829cb9a9e"}