{"aggregateHash":"0000000000000000000000000000000000000000000000000000000000000000","entries":[{"opaqueSourceUnitId":"0000000000000000000000000000000000000000000000000000000000000000","payload":{"displayName":"x"},"payloadHash":"0000000000000000000000000000000000000000000000000000000000000000","payloadKind":"raw_file_display_name","payloadKindRank":0,"payloadOrdinal":0,"sourceUnitKind":"raw_file","sourceUnitOrdinal":0,"sourceUnitPayloadRef":"0000000000000000000000000000000000000000000000000000000000000000"}],"entryCount":1,"schemaVersion":"source-unit-resolver.v1","sourceSha256":"0000000000000000000000000000000000000000000000000000000000000000"}